[
  {
    "id": 1,
    "questionText": "Which DoS attack classification involves all compromised computers sharing a common pseudo-random permutation of the IP address space?",
    "options": [
      "Random Scanning",
      "Permutation Scanning",
      "Signpost Scanning",
      "Hitlist Scanning",
      "Subnet Spoofing"
    ],
    "correctAnswer": ["Permutation Scanning"],
    "answerType": "radio",
    "meta": {
      "sourceFile": "L02_DDoS_Attack.pdf",
      "pageNumber": 1,
      "topic": "DDoS Attacks"
    }
  },
  {
    "id": 2,
    "questionText": "According to the lecture, what are the two primary types of amplification attacks?",
    "options": [
      "DoS bug and DoS flood",
      "TCP flood and UDP bug",
      "Link layer flood and Application bug",
      "SYN flood and DNS bug",
      "Infrastructure attack and Server attack"
    ],
    "correctAnswer": ["DoS bug and DoS flood"],
    "answerType": "radio",
    "meta": {
      "sourceFile": "L02_DDoS_Attack.pdf",
      "pageNumber": 2,
      "topic": "DDoS Attacks"
    }
  },
  {
    "id": 3,
    "questionText": "How does a TCP SYN flood attack exploit the TCP handshake process to cause a Denial of Service?",
    "options": [
      "It sends many SYN packets with spoofed source IPs, causing the server to exhaust its memory waiting for ACK packets that never arrive.",
      "It sends many oversized ACK packets to established connections, overwhelming the server's bandwidth.",
      "It sends FIN packets with incorrect sequence numbers to prematurely close legitimate connections.",
      "It exploits a bug in the TCP checksum calculation to crash the network stack of the server.",
      "It sends SYN packets to ports that are not open, causing the server to generate a high volume of ICMP error messages."
    ],
    "correctAnswer": ["It sends many SYN packets with spoofed source IPs, causing the server to exhaust its memory waiting for ACK packets that never arrive."],
    "answerType": "radio",
    "meta": {
      "sourceFile": "L02_DDoS_Attack.pdf",
      "pageNumber": 6,
      "topic": "DDoS Attacks"
    }
  },
  {
    "id": 4,
    "questionText": "What is proposed as the 'Correct Solution' to defend against low-rate SYN flood attacks?",
    "options": [
      "Using Syncookies to remove state from the server",
      "Increasing the backlog queue size to hold more pending connections",
      "Decreasing the timeout for half-open connections",
      "Blocking all incoming SYN packets with a firewall",
      "Deploying a more powerful server with additional RAM"
    ],
    "correctAnswer": ["Using Syncookies to remove state from the server"],
    "answerType": "radio",
    "meta": {
      "sourceFile": "L02_DDoS_Attack.pdf",
      "pageNumber": 7,
      "topic": "DDoS Attacks"
    }
  },
  {
    "id": 5,
    "questionText": "What is a key consequence for an attacker launching a TCP connection flood attack that completes the full TCP handshake?",
    "options": [
      "The attacker can no longer use random source IPs, which reveals the location of the bot zombies.",
      "The attack becomes significantly less effective at consuming server resources.",
      "The attack requires more bandwidth than a standard SYN flood.",
      "A SYN flood protection proxy can no longer detect the attack at all.",
      "The attack is easier for beginner attackers to launch."
    ],
    "correctAnswer": ["The attacker can no longer use random source IPs, which reveals the location of the bot zombies."],
    "answerType": "radio",
    "meta": {
      "sourceFile": "L02_DDoS_Attack.pdf",
      "pageNumber": 9,
      "topic": "DDoS Attacks"
    }
  },
  {
    "id": 6,
    "questionText": "What is the primary implementation problem with Ingress Filtering as a DoS mitigation technique?",
    "options": [
      "It requires global adoption by all ISPs to be effective, but there is little incentive for individual deployment.",
      "It is too computationally expensive for modern routers to handle at line speed.",
      "It cannot stop packets where the source IP has been spoofed.",
      "It only works for UDP traffic and is ineffective against TCP-based attacks.",
      "It requires fundamental changes to the IP packet format, which is not feasible."
    ],
    "correctAnswer": ["It requires global adoption by all ISPs to be effective, but there is little incentive for individual deployment."],
    "answerType": "radio",
    "meta": {
      "sourceFile": "L02_DDoS_Attack.pdf",
      "pageNumber": 16,
      "topic": "DDoS Attacks"
    }
  },
  {
    "id": 7,
    "questionText": "In the Edge Sampling traceback mechanism, what information is probabilistically written into a packet by a router to help reconstruct the attack path?",
    "options": [
      "An edge (start and end IP addresses) and a distance (number of hops since the edge was stored).",
      "The entire path from the source to the current router.",
      "A timestamp and the router's unique ID.",
      "A digital signature from the router to prove its identity.",
      "The router's MAC address and the ingress port number."
    ],
    "correctAnswer": ["An edge (start and end IP addresses) and a distance (number of hops since the edge was stored)."],
    "answerType": "radio",
    "meta": {
      "sourceFile": "L02_DDoS_Attack.pdf",
      "pageNumber": 18,
      "topic": "DDoS Attacks"
    }
  },
  {
    "id": 8,
    "questionText": "What is the fundamental security problem regarding authentication in the Internet Protocol (IP)?",
    "options": [
      "There is no built-in mechanism for source IP authentication, allowing for easy spoofing.",
      "The destination IP address is not authenticated, allowing for man-in-the-middle attacks.",
      "The Time-to-Live (TTL) field can be forged, creating infinite routing loops.",
      "IP headers are not encrypted by default, allowing eavesdropping.",
      "The IP header checksum is weak and easily bypassed by attackers."
    ],
    "correctAnswer": ["There is no built-in mechanism for source IP authentication, allowing for easy spoofing."],
    "answerType": "radio",
    "meta": {
      "sourceFile": "L05-Security of Internet Protocols.pdf",
      "pageNumber": 4,
      "topic": "TCP/IP Security"
    }
  },
  {
    "id": 9,
    "questionText": "Why is it critical for the Transmission Control Protocol (TCP) to use random initial sequence numbers?",
    "options": [
      "Predictable sequence numbers would allow an attacker to create a TCP session on behalf of a forged source IP.",
      "Random sequence numbers prevent packet loss during transmission over unreliable networks.",
      "It is the primary mechanism that ensures the in-order delivery of packets.",
      "Randomness is essential for the TCP congestion control algorithm to function correctly.",
      "It is required for IP fragmentation and reassembly to work with TCP segments."
    ],
    "correctAnswer": ["Predictable sequence numbers would allow an attacker to create a TCP session on behalf of a forged source IP."],
    "answerType": "radio",
    "meta": {
      "sourceFile": "L05-Security of Internet Protocols.pdf",
      "pageNumber": 7,
      "topic": "TCP/IP Security"
    }
  },
  {
    "id": 10,
    "questionText": "How can the Address Resolution Protocol (ARP) be exploited in a local network attack?",
    "options": [
      "A malicious node can send a false ARP reply, causing a gateway to send it traffic intended for another node.",
      "By sending oversized ARP packets to crash the gateway's network interface.",
      "By flooding the network with ARP requests to cause a denial of service.",
      "By encrypting ARP replies so that only the attacker can communicate with the gateway.",
      "By modifying the gateway's static ARP table through a buffer overflow."
    ],
    "correctAnswer": ["A malicious node can send a false ARP reply, causing a gateway to send it traffic intended for another node."],
    "answerType": "radio",
    "meta": {
      "sourceFile": "L05-Security of Internet Protocols.pdf",
      "pageNumber": 10,
      "topic": "TCP/IP Security"
    }
  },
  {
    "id": 11,
    "questionText": "What is the primary security issue with the Border Gateway Protocol (BGP) that allows for attacks like route hijacking?",
    "options": [
      "Route updates are unauthenticated, allowing any AS to inject false advertisements for arbitrary routes.",
      "BGP messages are sent in plaintext, allowing attackers to easily sniff sensitive routing information.",
      "BGP is vulnerable to buffer overflow attacks that can crash routers.",
      "BGP routers often have weak default passwords that are easily guessed.",
      "BGP does not have native support for IPv6, creating security gaps in modern networks."
    ],
    "correctAnswer": ["Route updates are unauthenticated, allowing any AS to inject false advertisements for arbitrary routes."],
    "answerType": "radio",
    "meta": {
      "sourceFile": "L05-Security of Internet Protocols.pdf",
      "pageNumber": 10,
      "topic": "TCP/IP Security"
    }
  },
  {
    "id": 12,
    "questionText": "In Secure BGP (S-BGP), what is the purpose of an 'Address Attestation'?",
    "options": [
      "It provides digitally-signed authorization for an Autonomous System (AS) to advertise specified address blocks.",
      "It encrypts the route update messages between peering routers.",
      "It validates that a router's physical hardware has not been tampered with.",
      "It signs every hop in a path advertisement to ensure path integrity.",
      "It provides a secure timestamp for each route update to prevent replay attacks."
    ],
    "correctAnswer": ["It provides digitally-signed authorization for an Autonomous System (AS) to advertise specified address blocks."],
    "answerType": "radio",
    "meta": {
      "sourceFile": "L05-Security of Internet Protocols.pdf",
      "pageNumber": 12,
      "topic": "TCP/IP Security"
    }